name,year,title,link
acl,2019,Better Exploiting Latent Variables in Text Modeling.,https://dblp.org/db/conf/acl/acl2019-1.html
acl,2019,Misleading Failures of Partial-input Baselines.,https://dblp.org/db/conf/acl/acl2019-1.html
acl,2019,Soft Contextual Data Augmentation for Neural Machine Translation.,https://dblp.org/db/conf/acl/acl2019-1.html
acl,2019,Reversing Gradients in Adversarial Domain Adaptation for Question Deduplication and Textual Entailment Tasks.,https://dblp.org/db/conf/acl/acl2019-1.html
acl,2019,Towards Integration of Statistical Hypothesis Tests into Deep Neural Networks.,https://dblp.org/db/conf/acl/acl2019-1.html
acl,2019,Depth Growing for Neural Machine Translation.,https://dblp.org/db/conf/acl/acl2019-1.html
acl,2019,Generating Fluent Adversarial Examples for Natural Languages.,https://dblp.org/db/conf/acl/acl2019-1.html
acl,2019,Towards Explainable NLP: A Generative Explanation Framework for Text Classification.,https://dblp.org/db/conf/acl/acl2019-1.html
acl,2019,Combating Adversarial Misspellings with Robust Word Recognition.,https://dblp.org/db/conf/acl/acl2019-1.html
acl,2019,An Empirical Investigation of Structured Output Modeling for Graph-based Neural Dependency Parsing.,https://dblp.org/db/conf/acl/acl2019-1.html
acl,2019,Observing Dialogue in Therapy: Categorizing and Forecasting Behavioral Codes.,https://dblp.org/db/conf/acl/acl2019-1.html
acl,2019,Multimodal Transformer Networks for End-to-End Video-Grounded Dialogue Systems.,https://dblp.org/db/conf/acl/acl2019-1.html
acl,2019,Target-Guided Open-Domain Conversation.,https://dblp.org/db/conf/acl/acl2019-1.html
acl,2019,Persuasion for Good: Towards a Personalized Persuasive Dialogue System for Social Good.,https://dblp.org/db/conf/acl/acl2019-1.html
acl,2019,Improving Neural Conversational Models with Entropy-Based Data Filtering.,https://dblp.org/db/conf/acl/acl2019-1.html
acl,2019,Zero-shot Word Sense Disambiguation using Sense Definition Embeddings.,https://dblp.org/db/conf/acl/acl2019-1.html
acl,2019,Language Modelling Makes Sense: Propagating Representations through WordNet for Full-Coverage Word Sense Disambiguation.,https://dblp.org/db/conf/acl/acl2019-1.html
acl,2019,Word2Sense: Sparse Interpretable Word Embeddings.,https://dblp.org/db/conf/acl/acl2019-1.html
acl,2019,Modeling Semantic Compositionality with Sememe Knowledge.,https://dblp.org/db/conf/acl/acl2019-1.html
acl,2019,Predicting Humorousness and Metaphor Novelty with Gaussian Process Preference Learning.,https://dblp.org/db/conf/acl/acl2019-1.html
acl,2019,Empirical Linguistic Study of Sentence Embeddings.,https://dblp.org/db/conf/acl/acl2019-1.html
acl,2019,Probing for Semantic Classes: Diagnosing the Meaning Content of Word Embeddings.,https://dblp.org/db/conf/acl/acl2019-1.html
acl,2019,Deep Neural Model Inspection and Comparison via Functional Neuron Pathways.,https://dblp.org/db/conf/acl/acl2019-1.html
acl,2019,Collocation Classification with Unsupervised Relation Vectors.,https://dblp.org/db/conf/acl/acl2019-1.html
acl,2019,Corpus-based Check-up for Thesaurus.,https://dblp.org/db/conf/acl/acl2019-1.html
acl,2019,Confusionset-guided Pointer Networks for Chinese Spelling Check.,https://dblp.org/db/conf/acl/acl2019-1.html
acl,2019,Generalized Data Augmentation for Low-Resource Translation.,https://dblp.org/db/conf/acl/acl2019-1.html
acl,2019,"Analyzing Multi-Head Self-Attention: Specialized Heads Do the Heavy Lifting, the Rest Can Be Pruned.",https://dblp.org/db/conf/acl/acl2019-1.html
acl,2019,Better OOV Translation with Bilingual Terminology Mining.,https://dblp.org/db/conf/acl/acl2019-1.html
acl,2019,Simultaneous Translation with Flexible Policy via Restricted Imitation Learning.,https://dblp.org/db/conf/acl/acl2019-1.html
acl,2019,Target Conditioned Sampling: Optimizing Data Selection for Multilingual Neural Machine Translation.,https://dblp.org/db/conf/acl/acl2019-1.html
acl,2019,Adversarial Learning of Privacy-Preserving Text Representations for De-Identification of Medical Records.,https://dblp.org/db/conf/acl/acl2019-1.html
acl,2019,Merge and Label: A Novel Neural Network Architecture for Nested NER.,https://dblp.org/db/conf/acl/acl2019-1.html
acl,2019,Low-resource Deep Entity Resolution with Transfer and Active Learning.,https://dblp.org/db/conf/acl/acl2019-1.html
acl,2019,A Semi-Markov Structured Support Vector Machine Model for High-Precision Named Entity Recognition.,https://dblp.org/db/conf/acl/acl2019-1.html
acl,2019,Using Human Attention to Extract Keyphrase from Microblog Post.,https://dblp.org/db/conf/acl/acl2019-1.html
acl,2019,Model-Agnostic Meta-Learning for Relation Classification with Limited Supervision.,https://dblp.org/db/conf/acl/acl2019-1.html
acl,2019,Variational Pretraining for Semi-supervised Text Classification.,https://dblp.org/db/conf/acl/acl2019-1.html
acl,2019,Task Refinement Learning for Improved Accuracy and Stability of Unsupervised Domain Adaptation.,https://dblp.org/db/conf/acl/acl2019-1.html
acl,2019,Optimal Transport-based Alignment of Learned Character Representations for String Similarity.,https://dblp.org/db/conf/acl/acl2019-1.html
acl,2019,The Referential Reader: A Recurrent Entity Network for Anaphora Resolution.,https://dblp.org/db/conf/acl/acl2019-1.html
acl,2019,Interpolated Spectral NGram Language Models.,https://dblp.org/db/conf/acl/acl2019-1.html
acl,2019,BAM! Born-Again Multi-Task Networks for Natural Language Understanding.,https://dblp.org/db/conf/acl/acl2019-1.html
acl,2019,Curate and Generate: A Corpus and Method for Joint Control of Semantics and Style in Neural NLG.,https://dblp.org/db/conf/acl/acl2019-1.html
acl,2019,Automated Chess Commentator Powered by Neural Chess Engine.,https://dblp.org/db/conf/acl/acl2019-1.html
acl,2019,Barack's Wife Hillary: Using Knowledge Graphs for Fact-Aware Language Modeling.,https://dblp.org/db/conf/acl/acl2019-1.html
acl,2019,Controllable Paraphrase Generation with a Syntactic Exemplar.,https://dblp.org/db/conf/acl/acl2019-1.html
acl,2019,Towards Comprehensive Description Generation from Factual Attribute-value Tables.,https://dblp.org/db/conf/acl/acl2019-1.html
acl,2019,Style Transformer: Unpaired Text Style Transfer without Disentangled Latent Representation.,https://dblp.org/db/conf/acl/acl2019-1.html
acl,2019,Generating Sentences from Disentangled Syntactic and Semantic Spaces.,https://dblp.org/db/conf/acl/acl2019-1.html
acl,2019,Learning to Control the Fine-grained Sentiment for Story Ending Generation.,https://dblp.org/db/conf/acl/acl2019-1.html
acl,2019,Self-Attention Architectures for Answer-Agnostic Neural Question Generation.,https://dblp.org/db/conf/acl/acl2019-1.html
acl,2019,Unsupervised Paraphrasing without Translation.,https://dblp.org/db/conf/acl/acl2019-1.html
acl,2019,Storyboarding of Recipes: Grounded Contextual Generation.,https://dblp.org/db/conf/acl/acl2019-1.html
acl,2019,Negative Lexically Constrained Decoding for Paraphrase Generation.,https://dblp.org/db/conf/acl/acl2019-1.html
acl,2019,Large-Scale Transfer Learning for Natural Language Generation.,https://dblp.org/db/conf/acl/acl2019-1.html
acl,2019,Automatic Grammatical Error Correction for Sequence-to-sequence Text Generation: An Empirical Study.,https://dblp.org/db/conf/acl/acl2019-1.html
acl,2019,Improving the Robustness of Question Answering Systems to Question Paraphrasing.,https://dblp.org/db/conf/acl/acl2019-1.html
acl,2019,RankQA: Neural Question Answering with Answer Re-Ranking.,https://dblp.org/db/conf/acl/acl2019-1.html
acl,2019,Latent Retrieval for Weakly Supervised Open Domain Question Answering.,https://dblp.org/db/conf/acl/acl2019-1.html
acl,2019,Multi-hop Reading Comprehension through Question Decomposition and Rescoring.,https://dblp.org/db/conf/acl/acl2019-1.html
acl,2019,Combining Knowledge Hunting and Neural Language Models to Solve the Winograd Schema Challenge.,https://dblp.org/db/conf/acl/acl2019-1.html
acl,2019,Careful Selection of Knowledge to Solve Open Book Question Answering.,https://dblp.org/db/conf/acl/acl2019-1.html
acl,2019,Learning Representation Mapping for Relation Detection in Knowledge Base Question Answering.,https://dblp.org/db/conf/acl/acl2019-1.html
acl,2019,Dynamically Fused Graph Network for Multi-hop Reasoning.,https://dblp.org/db/conf/acl/acl2019-1.html
acl,2019,NLProlog: Reasoning with Weak Unification for Question Answering in Natural Language.,https://dblp.org/db/conf/acl/acl2019-1.html
acl,2019,Modeling Intra-Relation in Math Word Problems with Different Functional Multi-Head Attentions.,https://dblp.org/db/conf/acl/acl2019-1.html
acl,2019,Synthetic QA Corpora Generation with Roundtrip Consistency.,https://dblp.org/db/conf/acl/acl2019-1.html
acl,2019,Are Red Roses Red? Evaluating Consistency of Question-Answering Models.,https://dblp.org/db/conf/acl/acl2019-1.html
acl,2019,MC\^2: Multi-perspective Convolutional Cube for Conversational Machine Reading Comprehension.,https://dblp.org/db/conf/acl/acl2019-1.html
acl,2019,Reducing Word Omission Errors in Neural Machine Translation: A Contrastive Learning Approach.,https://dblp.org/db/conf/acl/acl2019-1.html
acl,2019,Exploiting Sentential Context for Neural Machine Translation.,https://dblp.org/db/conf/acl/acl2019-1.html
acl,2019,Wetin dey with these comments? Modeling Sociolinguistic Factors Affecting Code-switching Behavior in Nigerian Online Discussions.,https://dblp.org/db/conf/acl/acl2019-1.html
acl,2019,Accelerating Sparse Matrix Operations in Neural Networks on Graphics Processing Units.,https://dblp.org/db/conf/acl/acl2019-1.html
acl,2019,An Automated Framework for Fast Cognate Detection and Bayesian Phylogenetic Inference in Computational Historical Linguistics.,https://dblp.org/db/conf/acl/acl2019-1.html
acl,2019,Sentence Centrality Revisited for Unsupervised Summarization.,https://dblp.org/db/conf/acl/acl2019-1.html
acl,2019,Discourse Representation Parsing for Sentences and Documents.,https://dblp.org/db/conf/acl/acl2019-1.html
acl,2019,Inducing Document Structure for Aspect-based Summarization.,https://dblp.org/db/conf/acl/acl2019-1.html
acl,2019,Incorporating Priors with Feature Attribution on Text Classification.,https://dblp.org/db/conf/acl/acl2019-1.html
acl,2019,Matching Article Pairs with Graphical Decomposition and Convolutions.,https://dblp.org/db/conf/acl/acl2019-1.html
acl,2019,Hierarchical Transfer Learning for Multi-label Text Classification.,https://dblp.org/db/conf/acl/acl2019-1.html
acl,2019,Bias Analysis and Mitigation in the Evaluation of Authorship Verification.,https://dblp.org/db/conf/acl/acl2019-1.html
acl,2019,Numeracy-600K: Learning Numeracy for Detecting Exaggerated Information in Market Comments.,https://dblp.org/db/conf/acl/acl2019-1.html
acl,2019,Large-Scale Multi-Label Text Classification on EU Legislation.,https://dblp.org/db/conf/acl/acl2019-1.html
acl,2019,Why Didn't You Listen to Me? Comparing User Control of Human-in-the-Loop Topic Models.,https://dblp.org/db/conf/acl/acl2019-1.html
acl,2019,Encouraging Paragraph Embeddings to Remember Sentence Identity Improves Classification.,https://dblp.org/db/conf/acl/acl2019-1.html
acl,2019,A Multi-Task Architecture on Relevance-based Neural Query Translation.,https://dblp.org/db/conf/acl/acl2019-1.html
acl,2019,Topic Modeling with Wasserstein Autoencoders.,https://dblp.org/db/conf/acl/acl2019-1.html
acl,2019,Dense Procedure Captioning in Narrated Instructional Videos.,https://dblp.org/db/conf/acl/acl2019-1.html
acl,2019,Latent Variable Model for Multi-modal Translation.,https://dblp.org/db/conf/acl/acl2019-1.html
acl,2019,Identifying Visible Actions in Lifestyle Vlogs.,https://dblp.org/db/conf/acl/acl2019-1.html
acl,2019,A Corpus for Reasoning about Natural Language Grounded in Photographs.,https://dblp.org/db/conf/acl/acl2019-1.html
acl,2019,"Learning to Discover, Ground and Use Words with Segmental Neural Language Models.",https://dblp.org/db/conf/acl/acl2019-1.html
acl,2019,What Should I Ask? Using Conversationally Informative Rewards for Goal-oriented Visual Dialog.,https://dblp.org/db/conf/acl/acl2019-1.html
acl,2019,Symbolic Inductive Bias for Visually Grounded Learning of Spoken Language.,https://dblp.org/db/conf/acl/acl2019-1.html
acl,2019,Multi-step Reasoning via Recurrent Dual Attention for Visual Dialog.,https://dblp.org/db/conf/acl/acl2019-1.html
acl,2019,Lattice Transformer for Speech Translation.,https://dblp.org/db/conf/acl/acl2019-1.html
acl,2019,Informative Image Captioning with External Sources of Information.,https://dblp.org/db/conf/acl/acl2019-1.html
acl,2019,CoDraw: Collaborative Drawing as a Testbed for Grounded Goal-driven Communication.,https://dblp.org/db/conf/acl/acl2019-1.html
acl,2019,Bridging by Word: Image Grounded Vocabulary Construction for Visual Captioning.,https://dblp.org/db/conf/acl/acl2019-1.html
acl,2019,Distilling Translations with Visual Awareness.,https://dblp.org/db/conf/acl/acl2019-1.html
acl,2019,VIFIDEL: Evaluating the Visual Fidelity of Image Descriptions.,https://dblp.org/db/conf/acl/acl2019-1.html
acl,2019,Are You Looking? Grounding to Multiple Modalities in Vision-and-Language Navigation.,https://dblp.org/db/conf/acl/acl2019-1.html
acl,2019,Multimodal Transformer for Unaligned Multimodal Language Sequences.,https://dblp.org/db/conf/acl/acl2019-1.html
acl,2019,"Show, Describe and Conclude: On Exploiting the Structure Information of Chest X-ray Reports.",https://dblp.org/db/conf/acl/acl2019-1.html
acl,2019,Visual Story Post-Editing.,https://dblp.org/db/conf/acl/acl2019-1.html
acl,2019,Multimodal Abstractive Summarization for How2 Videos.,https://dblp.org/db/conf/acl/acl2019-1.html
acl,2019,Learning to Relate from Captions and Bounding Boxes.,https://dblp.org/db/conf/acl/acl2019-1.html
acl,2021,"Proceedings of the 59th Annual Meeting of the Association for Computational Linguistics and the 11th International Joint Conference on Natural Language Processing, ACL/IJCNLP 2021, (Volume 1: Long Papers), Virtual Event, August 1-6, 2021.",https://dblp.org/db/conf/acl/acl2021-1.html
acl,2021,Frontmatter.,https://dblp.org/db/conf/acl/acl2021-1.html
acl,2021,Investigating label suggestions for opinion mining in German Covid-19 social media.,https://dblp.org/db/conf/acl/acl2021-1.html
acl,2021,How Did This Get Funded?! Automatically Identifying Quirky Scientific Achievements.,https://dblp.org/db/conf/acl/acl2021-1.html
acl,2021,Engage the Public: Poll Question Generation for Social Media Posts.,https://dblp.org/db/conf/acl/acl2021-1.html
acl,2021,HateCheck: Functional Tests for Hate Speech Detection Models.,https://dblp.org/db/conf/acl/acl2021-1.html
acl,2021,Unified Dual-view Cognitive Model for Interpretable Claim Verification.,https://dblp.org/db/conf/acl/acl2021-1.html
acl,2021,DeepRapper: Neural Rap Generation with Rhyme and Rhythm Modeling.,https://dblp.org/db/conf/acl/acl2021-1.html
acl,2021,PENS: A Dataset and Generic Framework for Personalized News Headline Generation.,https://dblp.org/db/conf/acl/acl2021-1.html
acl,2021,Enhancing Content Preservation in Text Style Transfer Using Reverse Attention and Conditional Layer Normalization.,https://dblp.org/db/conf/acl/acl2021-1.html
acl,2021,Mention Flags (MF): Constraining Transformer-based Text Generators.,https://dblp.org/db/conf/acl/acl2021-1.html
acl,2021,Generalising Multilingual Concept-to-Text NLG with Language Agnostic Delexicalisation.,https://dblp.org/db/conf/acl/acl2021-1.html
acl,2021,Conversations Are Not Flat: Modeling the Dynamic Information Flow across Dialogue Utterances.,https://dblp.org/db/conf/acl/acl2021-1.html
acl,2021,Dual Slot Selector via Local Reliability Verification for Dialogue State Tracking.,https://dblp.org/db/conf/acl/acl2021-1.html
acl,2021,Transferable Dialogue Systems and User Simulators.,https://dblp.org/db/conf/acl/acl2021-1.html
acl,2021,BoB: BERT Over BERT for Training Persona-based Dialogue Models from Limited Personalized Data.,https://dblp.org/db/conf/acl/acl2021-1.html
acl,2021,GL-GIN: Fast and Accurate Non-Autoregressive Model for Joint Multiple Intent Detection and Slot Filling.,https://dblp.org/db/conf/acl/acl2021-1.html
acl,2021,Accelerating BERT Inference for Sequence Labeling via Early-Exit.,https://dblp.org/db/conf/acl/acl2021-1.html
acl,2021,Modularized Interaction Network for Named Entity Recognition.,https://dblp.org/db/conf/acl/acl2021-1.html
acl,2021,Capturing Event Argument Interaction via A Bi-Directional Entity-Level Recurrent Decoder.,https://dblp.org/db/conf/acl/acl2021-1.html
acl,2021,UniRE: A Unified Label Space for Entity Relation Extraction.,https://dblp.org/db/conf/acl/acl2021-1.html
acl,2021,Refining Sample Embeddings with Relation Prototypes to Enhance Continual Relation Extraction.,https://dblp.org/db/conf/acl/acl2021-1.html
acl,2021,Contrastive Learning for Many-to-many Multilingual Neural Machine Translation.,https://dblp.org/db/conf/acl/acl2021-1.html
acl,2021,Understanding the Properties of Minimum Bayes Risk Decoding in Neural Machine Translation.,https://dblp.org/db/conf/acl/acl2021-1.html
acl,2021,Multi-Head Highly Parallelized LSTM Decoder for Neural Machine Translation.,https://dblp.org/db/conf/acl/acl2021-1.html
acl,2021,A Bidirectional Transformer Based Alignment Model for Unsupervised Word Alignment.,https://dblp.org/db/conf/acl/acl2021-1.html
acl,2021,Learning Language Specific Sub-network for Multilingual Machine Translation.,https://dblp.org/db/conf/acl/acl2021-1.html
acl,2021,Exploring the Efficacy of Automatically Generated Counterfactuals for Sentiment Analysis.,https://dblp.org/db/conf/acl/acl2021-1.html
acl,2021,Bridge-Based Active Domain Adaptation for Aspect Term Extraction.,https://dblp.org/db/conf/acl/acl2021-1.html
acl,2021,Multimodal Sentiment Detection Based on Multi-channel Graph Neural Networks.,https://dblp.org/db/conf/acl/acl2021-1.html
acl,2021,Aspect-Category-Opinion-Sentiment Quadruple Extraction with Implicit Aspects and Opinions.,https://dblp.org/db/conf/acl/acl2021-1.html
acl,2021,PASS: Perturb-and-Select Summarizer for Product Reviews.,https://dblp.org/db/conf/acl/acl2021-1.html
acl,2021,Deep Differential Amplifier for Extractive Summarization.,https://dblp.org/db/conf/acl/acl2021-1.html
acl,2021,Multi-TimeLine Summarization (MTLS): Improving Timeline Summarization by Generating Multiple Summaries.,https://dblp.org/db/conf/acl/acl2021-1.html
acl,2021,Self-Supervised Multimodal Opinion Summarization.,https://dblp.org/db/conf/acl/acl2021-1.html
acl,2021,A Training-free and Reference-free Summarization Evaluation Metric via Centrality-weighted Relevance and Self-referenced Redundancy.,https://dblp.org/db/conf/acl/acl2021-1.html
acl,2021,DESCGEN: A Distantly Supervised Datasetfor Generating Entity Descriptions.,https://dblp.org/db/conf/acl/acl2021-1.html
acl,2021,Introducing Orthogonal Constraint in Structural Probes.,https://dblp.org/db/conf/acl/acl2021-1.html
acl,2021,Hidden Killer: Invisible Textual Backdoor Attacks with Syntactic Trigger.,https://dblp.org/db/conf/acl/acl2021-1.html
acl,2021,Examining the Inductive Bias of Neural Language Models with Artificial Languages.,https://dblp.org/db/conf/acl/acl2021-1.html
acl,2021,Explaining Contextualization in Language Models using Visual Analytics.,https://dblp.org/db/conf/acl/acl2021-1.html
acl,2021,Improving the Faithfulness of Attention-based Explanations with Task-specific Information for Text Classification.,https://dblp.org/db/conf/acl/acl2021-1.html
acl,2021,Generating Landmark Navigation Instructions from Maps as a Graph-to-Text Problem.,https://dblp.org/db/conf/acl/acl2021-1.html
acl,2021,E2E-VLP: End-to-End Vision-Language Pre-training Enhanced by Visual Learning.,https://dblp.org/db/conf/acl/acl2021-1.html
acl,2021,Learning Relation Alignment for Calibrated Cross-modal Retrieval.,https://dblp.org/db/conf/acl/acl2021-1.html
acl,2021,KM-BART: Knowledge Enhanced Multimodal BART for Visual Commonsense Generation.,https://dblp.org/db/conf/acl/acl2021-1.html
acl,2021,Cascaded Head-colliding Attention.,https://dblp.org/db/conf/acl/acl2021-1.html
acl,2021,Structural Knowledge Distillation: Tractably Distilling Information for Structured Predictor.,https://dblp.org/db/conf/acl/acl2021-1.html
acl,2021,Parameter-efficient Multi-task Fine-tuning for Transformers via Shared Hypernetworks.,https://dblp.org/db/conf/acl/acl2021-1.html
acl,2021,COSY: COunterfactual SYntax for Cross-Lingual Understanding.,https://dblp.org/db/conf/acl/acl2021-1.html
acl,2021,OoMMix: Out-of-manifold Regularization in Contextual Embedding Space for Text Classification.,https://dblp.org/db/conf/acl/acl2021-1.html
acl,2021,Understanding and Countering Stereotypes: A Computational Approach to the Stereotype Content Model.,https://dblp.org/db/conf/acl/acl2021-1.html
acl,2021,Structurizing Misinformation Stories via Rationalizing Fact-Checks.,https://dblp.org/db/conf/acl/acl2021-1.html
acl,2021,Modeling Language Usage and Listener Engagement in Podcasts.,https://dblp.org/db/conf/acl/acl2021-1.html
acl,2021,Breaking Down the Invisible Wall of Informal Fallacies in Online Discussions.,https://dblp.org/db/conf/acl/acl2021-1.html
acl,2021,SocAoG: Incremental Graph Parsing for Social Relation Inference in Dialogues.,https://dblp.org/db/conf/acl/acl2021-1.html
acl,2021,"TicketTalk: Toward human-level performance with end-to-end, transaction-based dialog systems.",https://dblp.org/db/conf/acl/acl2021-1.html
acl,2021,Improving Dialog Systems for Negotiation with Personality Modeling.,https://dblp.org/db/conf/acl/acl2021-1.html
acl,2021,Learning from Perturbations: Diverse and Informative Dialogue Generation with Inverse Adversarial Training.,https://dblp.org/db/conf/acl/acl2021-1.html
acl,2021,Increasing Faithfulness in Knowledge-Grounded Dialogue with Controllable Features.,https://dblp.org/db/conf/acl/acl2021-1.html
acl,2021,CitationIE: Leveraging the Citation Graph for Scientific Information Extraction.,https://dblp.org/db/conf/acl/acl2021-1.html
acl,2021,From Discourse to Narrative: Knowledge Projection for Event Relation Extraction.,https://dblp.org/db/conf/acl/acl2021-1.html
acl,2021,AdvPicker: Effectively Leveraging Unlabeled Data via Adversarial Discriminator for Cross-Lingual NER.,https://dblp.org/db/conf/acl/acl2021-1.html
acl,2021,Compare to The Knowledge: Graph Neural Fake News Detection with External Knowledge.,https://dblp.org/db/conf/acl/acl2021-1.html
acl,2021,Discontinuous Named Entity Recognition as Maximal Clique Discovery.,https://dblp.org/db/conf/acl/acl2021-1.html
acl,2021,LNN-EL: A Neuro-Symbolic Approach to Short-text Entity Linking.,https://dblp.org/db/conf/acl/acl2021-1.html
acl,2021,Do Context-Aware Translation Models Pay the Right Attention?,https://dblp.org/db/conf/acl/acl2021-1.html
acl,2021,Adapting High-resource NMT Models to Translate Low-resource Related Languages without Parallel Data.,https://dblp.org/db/conf/acl/acl2021-1.html
acl,2021,Bilingual Lexicon Induction via Unsupervised Bitext Construction and Word Alignment.,https://dblp.org/db/conf/acl/acl2021-1.html
acl,2021,Multilingual Speech Translation from Efficient Finetuning of Pretrained Models.,https://dblp.org/db/conf/acl/acl2021-1.html
acl,2021,Learning Faithful Representations of Causal Graphs.,https://dblp.org/db/conf/acl/acl2021-1.html
acl,2021,What Context Features Can Transformer Language Models Use?,https://dblp.org/db/conf/acl/acl2021-1.html
acl,2021,Integrated Directional Gradients: Feature Interaction Attribution for Neural NLP Models.,https://dblp.org/db/conf/acl/acl2021-1.html
acl,2021,DeCLUTR: Deep Contrastive Learning for Unsupervised Textual Representations.,https://dblp.org/db/conf/acl/acl2021-1.html
acl,2021,XLPT-AMR: Cross-Lingual Pre-Training via Multi-Task Learning for Zero-Shot AMR Parsing and Text Generation.,https://dblp.org/db/conf/acl/acl2021-1.html
acl,2021,Span-based Semantic Parsing for Compositional Generalization.,https://dblp.org/db/conf/acl/acl2021-1.html
acl,2021,Compositional Generalization and Natural Language Variation: Can a Semantic Parsing Approach Handle Both?,https://dblp.org/db/conf/acl/acl2021-1.html
acl,2021,A Targeted Assessment of Incremental Processing in Neural Language Models and Humans.,https://dblp.org/db/conf/acl/acl2021-1.html
acl,2021,"The Possible, the Plausible, and the Desirable: Event-Based Modality Detection for Language Processing.",https://dblp.org/db/conf/acl/acl2021-1.html
acl,2021,To POS Tag or Not to POS Tag: The Impact of POS Tags on Morphological Learning in Low-Resource Settings.,https://dblp.org/db/conf/acl/acl2021-1.html
acl,2021,Prosodic segmentation for parsing spoken dialogue.,https://dblp.org/db/conf/acl/acl2021-1.html
acl,2021,"VoxPopuli: A Large-Scale Multilingual Speech Corpus for Representation Learning, Semi-Supervised Learning and Interpretation.",https://dblp.org/db/conf/acl/acl2021-1.html
acl,2021,Stereotyping Norwegian Salmon: An Inventory of Pitfalls in Fairness Benchmark Datasets.,https://dblp.org/db/conf/acl/acl2021-1.html
acl,2021,Robust Knowledge Graph Completion with Stacked Convolutions and a Student Re-Ranking Network.,https://dblp.org/db/conf/acl/acl2021-1.html
acl,2021,A DQN-based Approach to Finding Precise Evidences for Fact Verification.,https://dblp.org/db/conf/acl/acl2021-1.html
acl,2021,The Art of Abstention: Selective Prediction and Error Regularization for Natural Language Processing.,https://dblp.org/db/conf/acl/acl2021-1.html
acl,2021,Unsupervised Out-of-Domain Detection via Pre-trained Transformers.,https://dblp.org/db/conf/acl/acl2021-1.html
acl,2021,"MATE-KD: Masked Adversarial TExt, a Companion to Knowledge Distillation.",https://dblp.org/db/conf/acl/acl2021-1.html
acl,2021,Selecting Informative Contexts Improves Language Model Fine-tuning.,https://dblp.org/db/conf/acl/acl2021-1.html
acl,2021,Explainable Prediction of Text Complexity: The Missing Preliminaries for Text Simplification.,https://dblp.org/db/conf/acl/acl2021-1.html
acl,2021,Multi-Task Retrieval for Knowledge-Intensive Tasks.,https://dblp.org/db/conf/acl/acl2021-1.html
