name,year,title,link
acl,2021,Learning from Miscellaneous Other-Class Words for Few-shot Named Entity Recognition.,https://dblp.org/db/conf/acl/acl2021-1.html
acl,2021,Joint Biomedical Entity and Relation Extraction with Knowledge-Enhanced Collective Inference.,https://dblp.org/db/conf/acl/acl2021-1.html
acl,2021,Fine-grained Information Extraction from Biomedical Literature based on Knowledge-enriched Abstract Meaning Representation.,https://dblp.org/db/conf/acl/acl2021-1.html
acl,2021,Unleash GPT-2 Power for Event Detection.,https://dblp.org/db/conf/acl/acl2021-1.html
acl,2021,CLEVE: Contrastive Pre-training for Event Extraction.,https://dblp.org/db/conf/acl/acl2021-1.html
acl,2021,Document-level Event Extraction via Parallel Prediction Networks.,https://dblp.org/db/conf/acl/acl2021-1.html
acl,2021,StructuralLM: Structural Pre-training for Form Understanding.,https://dblp.org/db/conf/acl/acl2021-1.html
acl,2021,Dual Graph Convolutional Networks for Aspect-based Sentiment Analysis.,https://dblp.org/db/conf/acl/acl2021-1.html
acl,2021,Multi-Label Few-Shot Learning for Aspect Category Detection.,https://dblp.org/db/conf/acl/acl2021-1.html
acl,2021,Argument Pair Extraction via Attention-guided Multi-Layer Multi-Cross Encoding.,https://dblp.org/db/conf/acl/acl2021-1.html
acl,2021,A Neural Transition-based Model for Argumentation Mining.,https://dblp.org/db/conf/acl/acl2021-1.html
acl,2021,Keep It Simple: Unsupervised Simplification of Multi-Paragraph Text.,https://dblp.org/db/conf/acl/acl2021-1.html
acl,2021,Long Text Generation by Modeling Sentence-Level and Discourse-Level Coherence.,https://dblp.org/db/conf/acl/acl2021-1.html
acl,2021,OpenMEVA: A Benchmark for Evaluating Open-ended Story Generation Metrics.,https://dblp.org/db/conf/acl/acl2021-1.html
acl,2021,DYPLOC: Dynamic Planning of Content Using Mixed Language Models for Text Generation.,https://dblp.org/db/conf/acl/acl2021-1.html
acl,2021,Controllable Open-ended Question Generation with A New Question Type Ontology.,https://dblp.org/db/conf/acl/acl2021-1.html
acl,2021,BERTGen: Multi-task Generation through BERT.,https://dblp.org/db/conf/acl/acl2021-1.html
acl,2021,Selective Knowledge Distillation for Neural Machine Translation.,https://dblp.org/db/conf/acl/acl2021-1.html
acl,2021,Measuring and Increasing Context Usage in Context-Aware Machine Translation.,https://dblp.org/db/conf/acl/acl2021-1.html
acl,2021,Beyond Offline Mapping: Learning Cross-lingual Word Embeddings through Context Anchoring.,https://dblp.org/db/conf/acl/acl2021-1.html
acl,2021,CCMatrix: Mining Billions of High-Quality Parallel Sentences on the Web.,https://dblp.org/db/conf/acl/acl2021-1.html
acl,2021,"Length-Adaptive Transformer: Train Once with Length Drop, Use Anytime with Search.",https://dblp.org/db/conf/acl/acl2021-1.html
acl,2021,GhostBERT: Generate More Features with Cheap Operations for BERT.,https://dblp.org/db/conf/acl/acl2021-1.html
acl,2021,Super Tickets in Pre-Trained Language Models: From Model Compression to Improving Generalization.,https://dblp.org/db/conf/acl/acl2021-1.html
acl,2021,A Novel Estimator of Mutual Information for Learning to Disentangle Textual Representations.,https://dblp.org/db/conf/acl/acl2021-1.html
acl,2021,Determinantal Beam Search.,https://dblp.org/db/conf/acl/acl2021-1.html
acl,2021,Multi-hop Graph Convolutional Network with High-order Chebyshev Approximation for Text Reasoning.,https://dblp.org/db/conf/acl/acl2021-1.html
acl,2021,Accelerating Text Communication via Abbreviated Sentence Input.,https://dblp.org/db/conf/acl/acl2021-1.html
acl,2021,"Regression Bugs Are In Your Model! Measuring, Reducing and Analyzing Regressions In NLP Model Updates.",https://dblp.org/db/conf/acl/acl2021-1.html
acl,2021,Detecting Propaganda Techniques in Memes.,https://dblp.org/db/conf/acl/acl2021-1.html
acl,2021,On the Efficacy of Adversarial Data Collection for Question Answering: Results from a Large-Scale Randomized Study.,https://dblp.org/db/conf/acl/acl2021-1.html
acl,2021,Learning Dense Representations of Phrases at Scale.,https://dblp.org/db/conf/acl/acl2021-1.html
acl,2021,End-to-End Training of Neural Retrievers for Open-Domain Question Answering.,https://dblp.org/db/conf/acl/acl2021-1.html
acl,2021,Question Answering Over Temporal Knowledge Graphs.,https://dblp.org/db/conf/acl/acl2021-1.html
acl,2021,Language Model Augmented Relevance Score.,https://dblp.org/db/conf/acl/acl2021-1.html
acl,2021,DExperts: Decoding-Time Controlled Text Generation with Experts and Anti-Experts.,https://dblp.org/db/conf/acl/acl2021-1.html
acl,2021,"Polyjuice: Generating Counterfactuals for Explaining, Evaluating, and Improving Models.",https://dblp.org/db/conf/acl/acl2021-1.html
acl,2021,Metaphor Generation with Conceptual Mappings.,https://dblp.org/db/conf/acl/acl2021-1.html
acl,2021,Learning Latent Structures for Cross Action Phrase Relations in Wet Lab Protocols.,https://dblp.org/db/conf/acl/acl2021-1.html
acl,2021,"Multimodal Multi-Speaker Merger &#38; Acquisition Financial Modeling: A New Task, Dataset, and Neural Baselines.",https://dblp.org/db/conf/acl/acl2021-1.html
acl,2021,Mid-Air Hand Gestures for Post-Editing of Machine Translation.,https://dblp.org/db/conf/acl/acl2021-1.html
acl,2021,Inter-GPS: Interpretable Geometry Problem Solving with Formal Language and Symbolic Reasoning.,https://dblp.org/db/conf/acl/acl2021-1.html
acl,2021,Joint Verification and Reranking for Open Fact Checking Over Tables.,https://dblp.org/db/conf/acl/acl2021-1.html
acl,2021,Evaluation of Thematic Coherence in Microblogs.,https://dblp.org/db/conf/acl/acl2021-1.html
acl,2021,Neural semi-Markov CRF for Monolingual Word Alignment.,https://dblp.org/db/conf/acl/acl2021-1.html
acl,2021,Privacy at Scale: Introducing the PrivaSeer Corpus of Web Privacy Policies.,https://dblp.org/db/conf/acl/acl2021-1.html
acl,2021,The statistical advantage of automatic NLG metrics at the system level.,https://dblp.org/db/conf/acl/acl2021-1.html
acl,2021,Are Missing Links Predictable? An Inferential Benchmark for Knowledge Graph Completion.,https://dblp.org/db/conf/acl/acl2021-1.html
acl,2021,ConvoSumm: Conversation Summarization Benchmark and Improved Abstractive Summarization with Argument Mining.,https://dblp.org/db/conf/acl/acl2021-1.html
acl,2021,Improving Factual Consistency of Abstractive Summarization via Question Answering.,https://dblp.org/db/conf/acl/acl2021-1.html
acl,2021,EmailSum: Abstractive Email Thread Summarization.,https://dblp.org/db/conf/acl/acl2021-1.html
acl,2021,Cross-Lingual Abstractive Summarization with Limited Parallel Resources.,https://dblp.org/db/conf/acl/acl2021-1.html
acl,2021,Dissecting Generation Modes for Abstractive Summarization Models via Ablation and Attribution.,https://dblp.org/db/conf/acl/acl2021-1.html
acl,2021,Learning Prototypical Functions for Physical Artifacts.,https://dblp.org/db/conf/acl/acl2021-1.html
acl,2021,Verb Knowledge Injection for Multilingual Event Processing.,https://dblp.org/db/conf/acl/acl2021-1.html
acl,2021,Dynamic Contextualized Word Embeddings.,https://dblp.org/db/conf/acl/acl2021-1.html
acl,2021,Lexical Semantic Change Discovery.,https://dblp.org/db/conf/acl/acl2021-1.html
acl,2021,The R-U-A-Robot Dataset: Helping Avoid Chatbot Deception by Detecting User Questions About Human or Non-Human Identity.,https://dblp.org/db/conf/acl/acl2021-1.html
acl,2021,Using Meta-Knowledge Mined from Identifiers to Improve Intent Recognition in Conversational Systems.,https://dblp.org/db/conf/acl/acl2021-1.html
acl,2021,Space Efficient Context Encoding for Non-Task-Oriented Dialogue Generation with Graph Attention Transformer.,https://dblp.org/db/conf/acl/acl2021-1.html
acl,2021,DialogueCRN: Contextual Reasoning Networks for Emotion Recognition in Conversations.,https://dblp.org/db/conf/acl/acl2021-1.html
acl,2021,Cross-replication Reliability - An Empirical Approach to Interpreting Inter-rater Reliability.,https://dblp.org/db/conf/acl/acl2021-1.html
acl,2021,TIMEDIAL: Temporal Commonsense Reasoning in Dialog.,https://dblp.org/db/conf/acl/acl2021-1.html
acl,2021,RAW-C: Relatedness of Ambiguous Words in Context (A New Lexical Resource for English).,https://dblp.org/db/conf/acl/acl2021-1.html
acl,2021,ARBERT &#38; MARBERT: Deep Bidirectional Transformers for Arabic.,https://dblp.org/db/conf/acl/acl2021-1.html
acl,2021,Improving Paraphrase Detection with the Adversarial Paraphrasing Task.,https://dblp.org/db/conf/acl/acl2021-1.html
acl,2021,ADEPT: An Adjective-Dependent Plausibility Task.,https://dblp.org/db/conf/acl/acl2021-1.html
acl,2021,ReadOnce Transformers: Reusable Representations of Text for Transformers.,https://dblp.org/db/conf/acl/acl2021-1.html
acl,2021,Conditional Generation of Temporally-ordered Event Sequences.,https://dblp.org/db/conf/acl/acl2021-1.html
acl,2021,Hate Speech Detection Based on Sentiment Knowledge Sharing.,https://dblp.org/db/conf/acl/acl2021-1.html
acl,2021,Transition-based Bubble Parsing: Improvements on Coordination Structure Prediction.,https://dblp.org/db/conf/acl/acl2021-1.html
acl,2021,SpanNER: Named Entity Re-/Recognition as Span Prediction.,https://dblp.org/db/conf/acl/acl2021-1.html
acl,2021,StructFormer: Joint Unsupervised Induction of Dependency and Constituency Structure from Masked Language Modeling.,https://dblp.org/db/conf/acl/acl2021-1.html
acl,2021,Language Embeddings for Typology and Cross-lingual Transfer Learning.,https://dblp.org/db/conf/acl/acl2021-1.html
acl,2021,Can Sequence-to-Sequence Models Crack Substitution Ciphers?,https://dblp.org/db/conf/acl/acl2021-1.html
acl,2021,Beyond Noise: Mitigating the Impact of Fine-grained Semantic Divergences on Neural Machine Translation.,https://dblp.org/db/conf/acl/acl2021-1.html
acl,2021,Discriminative Reranking for Neural Machine Translation.,https://dblp.org/db/conf/acl/acl2021-1.html
acl,2021,Mind Your Outliers! Investigating the Negative Impact of Outliers on Active Learning for Visual Question Answering.,https://dblp.org/db/conf/acl/acl2021-1.html
acl,2021,All That's 'Human' Is Not Gold: Evaluating Human Evaluation of Generated Text.,https://dblp.org/db/conf/acl/acl2021-1.html
acl,2021,Scientific Credibility of Machine Translation Research: A Meta-Evaluation of 769 Papers.,https://dblp.org/db/conf/acl/acl2021-1.html
acl,2021,Neural Machine Translation with Monolingual Translation Memory.,https://dblp.org/db/conf/acl/acl2021-1.html
acl,2021,Intrinsic Dimensionality Explains the Effectiveness of Language Model Fine-Tuning.,https://dblp.org/db/conf/acl/acl2021-1.html
acl,2021,UnNatural Language Inference.,https://dblp.org/db/conf/acl/acl2021-1.html
acl,2021,Including Signed Languages in Natural Language Processing.,https://dblp.org/db/conf/acl/acl2021-1.html
acl,2021,Vocabulary Learning via Optimal Transport for Neural Machine Translation.,https://dblp.org/db/conf/acl/acl2021-1.html
acl,2022,"Proceedings of the 60th Annual Meeting of the Association for Computational Linguistics (Volume 1: Long Papers), ACL 2022, Dublin, Ireland, May 22-27, 2022.",https://dblp.org/db/conf/acl/acl2022-1.html
acl,2022,Frontmatter.,https://dblp.org/db/conf/acl/acl2022-1.html
acl,2022,AdapLeR: Speeding up Inference by Adaptive Length Reduction.,https://dblp.org/db/conf/acl/acl2022-1.html
acl,2022,Quantified Reproducibility Assessment of NLP Results.,https://dblp.org/db/conf/acl/acl2022-1.html
acl,2022,Rare Tokens Degenerate All Tokens: Improving Neural Text Generation via Adaptive Gradient Gating for Rare Token Embeddings.,https://dblp.org/db/conf/acl/acl2022-1.html
acl,2022,AlephBERT: Language Model Pre-training and Evaluation from Sub-Word to Sentence Level.,https://dblp.org/db/conf/acl/acl2022-1.html
acl,2022,Learning to Imagine: Integrating Counterfactual Thinking in Neural Discrete Reasoning.,https://dblp.org/db/conf/acl/acl2022-1.html
acl,2022,Domain Adaptation in Multilingual and Multi-Domain Monolingual Settings for Complex Word Identification.,https://dblp.org/db/conf/acl/acl2022-1.html
acl,2022,JointCL: A Joint Contrastive Learning Framework for Zero-Shot Stance Detection.,https://dblp.org/db/conf/acl/acl2022-1.html
acl,2022,[CASPI] Causal-aware Safe Policy Improvement for Task-oriented Dialogue.,https://dblp.org/db/conf/acl/acl2022-1.html
acl,2022,UniTranSeR: A Unified Transformer Semantic Representation Framework for Multimodal Task-Oriented Dialog System.,https://dblp.org/db/conf/acl/acl2022-1.html
acl,2022,Dynamic Schema Graph Fusion Network for Multi-Domain Dialogue State Tracking.,https://dblp.org/db/conf/acl/acl2022-1.html
acl,2022,Attention Temperature Matters in Abstractive Summarization Distillation.,https://dblp.org/db/conf/acl/acl2022-1.html
acl,2022,Towards Making the Most of Cross-Lingual Transfer for Zero-Shot Neural Machine Translation.,https://dblp.org/db/conf/acl/acl2022-1.html
acl,2022,TopWORDS-Seg: Simultaneous Text Segmentation and Word Discovery for Open-Domain Chinese Texts via Bayesian Inference.,https://dblp.org/db/conf/acl/acl2022-1.html
acl,2022,An Unsupervised Multiple-Task and Multiple-Teacher Model for Cross-lingual Named Entity Recognition.,https://dblp.org/db/conf/acl/acl2022-1.html
acl,2022,Discriminative Marginalized Probabilistic Neural Method for Multi-Document Summarization of Medical Literature.,https://dblp.org/db/conf/acl/acl2022-1.html
acl,2022,Sparse Progressive Distillation: Resolving Overfitting under Pretrain-and-Finetune Paradigm.,https://dblp.org/db/conf/acl/acl2022-1.html
acl,2022,CipherDAug: Ciphertext based Data Augmentation for Neural Machine Translation.,https://dblp.org/db/conf/acl/acl2022-1.html
acl,2022,Overlap-based Vocabulary Generation Improves Cross-lingual Transfer Among Related Languages.,https://dblp.org/db/conf/acl/acl2022-1.html
acl,2022,Long-range Sequence Modeling with Predictable Sparse Attention.,https://dblp.org/db/conf/acl/acl2022-1.html
acl,2022,Improving Personalized Explanation Generation through Visualization.,https://dblp.org/db/conf/acl/acl2022-1.html
acl,2022,New Intent Discovery with Pre-training and Contrastive Learning.,https://dblp.org/db/conf/acl/acl2022-1.html
acl,2022,Modeling U.S. State-Level Policies by Extracting Winners and Losers from Legislative Texts.,https://dblp.org/db/conf/acl/acl2022-1.html
acl,2022,Structural Characterization for Dialogue Disentanglement.,https://dblp.org/db/conf/acl/acl2022-1.html
acl,2022,Multi-Party Empathetic Dialogue Generation: A New Task for Dialog Systems.,https://dblp.org/db/conf/acl/acl2022-1.html
acl,2022,MISC: A Mixed Strategy-Aware Model integrating COMET for Emotional Support Conversation.,https://dblp.org/db/conf/acl/acl2022-1.html
acl,2022,GLM: General Language Model Pretraining with Autoregressive Blank Infilling.,https://dblp.org/db/conf/acl/acl2022-1.html
acl,2022,QuoteR: A Benchmark of Quote Recommendation for Writing.,https://dblp.org/db/conf/acl/acl2022-1.html
acl,2022,Towards Comprehensive Patent Approval Predictions: Beyond Traditional Document Classification.,https://dblp.org/db/conf/acl/acl2022-1.html
acl,2022,Hypergraph Transformer: Weakly-Supervised Multi-hop Reasoning for Knowledge-based Visual Question Answering.,https://dblp.org/db/conf/acl/acl2022-1.html
acl,2022,Cross-Utterance Conditioned VAE for Non-Autoregressive Text-to-Speech.,https://dblp.org/db/conf/acl/acl2022-1.html
acl,2022,Mix and Match: Learning-free Controllable Text Generationusing Energy Language Models.,https://dblp.org/db/conf/acl/acl2022-1.html
acl,2022,So Different Yet So Alike! Constrained Unsupervised Text Style Transfer.,https://dblp.org/db/conf/acl/acl2022-1.html
acl,2022,e-CARE: a New Dataset for Exploring Explainable Causal Reasoning.,https://dblp.org/db/conf/acl/acl2022-1.html
acl,2022,Fantastic Questions and Where to Find Them: FairytaleQA - An Authentic Dataset for Narrative Comprehension.,https://dblp.org/db/conf/acl/acl2022-1.html
acl,2022,KaFSP: Knowledge-Aware Fuzzy Semantic Parsing for Conversational Question Answering over a Large-Scale Knowledge Base.,https://dblp.org/db/conf/acl/acl2022-1.html
acl,2022,Multilingual Knowledge Graph Completion with Self-Supervised Adaptive Graph Alignment.,https://dblp.org/db/conf/acl/acl2022-1.html
acl,2022,Modeling Hierarchical Syntax Structure with Triplet Position for Source Code Summarization.,https://dblp.org/db/conf/acl/acl2022-1.html
acl,2022,FewNLU: Benchmarking State-of-the-Art Methods for Few-Shot Natural Language Understanding.,https://dblp.org/db/conf/acl/acl2022-1.html
acl,2022,Learn to Adapt for Generalized Zero-Shot Text Classification.,https://dblp.org/db/conf/acl/acl2022-1.html
acl,2022,TableFormer: Robust Transformer Modeling for Table-Text Encoding.,https://dblp.org/db/conf/acl/acl2022-1.html
acl,2022,Perceiving the World: Question-guided Reinforcement Learning for Text-based Games.,https://dblp.org/db/conf/acl/acl2022-1.html
acl,2022,Neural Label Search for Zero-Shot Multi-Lingual Extractive Summarization.,https://dblp.org/db/conf/acl/acl2022-1.html
acl,2022,Few-Shot Class-Incremental Learning for Named Entity Recognition.,https://dblp.org/db/conf/acl/acl2022-1.html
acl,2022,Improving Meta-learning for Low-resource Text Classification and Generation via Memory Imitation.,https://dblp.org/db/conf/acl/acl2022-1.html
acl,2022,Quality Controlled Paraphrase Generation.,https://dblp.org/db/conf/acl/acl2022-1.html
acl,2022,Controllable Dictionary Example Generation: Generating Example Sentences for Specific Targeted Audiences.,https://dblp.org/db/conf/acl/acl2022-1.html
acl,2022,AraT5: Text-to-Text Transformers for Arabic Language Generation.,https://dblp.org/db/conf/acl/acl2022-1.html
acl,2022,Legal Judgment Prediction via Event Extraction with Constraints.,https://dblp.org/db/conf/acl/acl2022-1.html
acl,2022,Answer-level Calibration for Free-form Multiple Choice Question Answering.,https://dblp.org/db/conf/acl/acl2022-1.html
acl,2022,Learning When to Translate for Streaming Speech.,https://dblp.org/db/conf/acl/acl2022-1.html
acl,2022,Compact Token Representations with Contextual Quantization for Efficient Document Re-ranking.,https://dblp.org/db/conf/acl/acl2022-1.html
acl,2022,Early Stopping Based on Unlabeled Samples in Text Classification.,https://dblp.org/db/conf/acl/acl2022-1.html
acl,2022,Meta-learning via Language Model In-context Tuning.,https://dblp.org/db/conf/acl/acl2022-1.html
acl,2022,It is AI's Turn to Ask Humans a Question: Question-Answer Pair Generation for Children's Story Books.,https://dblp.org/db/conf/acl/acl2022-1.html
acl,2022,Prompt-Based Rule Discovery and Boosting for Interactive Weakly-Supervised Learning.,https://dblp.org/db/conf/acl/acl2022-1.html
acl,2022,Constrained Multi-Task Learning for Bridging Resolution.,https://dblp.org/db/conf/acl/acl2022-1.html
acl,2022,DEAM: Dialogue Coherence Evaluation using AMR-based Semantic Manipulations.,https://dblp.org/db/conf/acl/acl2022-1.html
acl,2022,HIBRIDS: Attention with Hierarchical Biases for Structure-aware Long Document Summarization.,https://dblp.org/db/conf/acl/acl2022-1.html
acl,2022,De-Bias for Generative Extraction in Unified NER Task.,https://dblp.org/db/conf/acl/acl2022-1.html
acl,2022,An Information-theoretic Approach to Prompt Engineering Without Ground Truth Labels.,https://dblp.org/db/conf/acl/acl2022-1.html
acl,2022,Expanding Pretrained Models to Thousands More Languages via Lexicon-based Adaptation.,https://dblp.org/db/conf/acl/acl2022-1.html
acl,2022,Language-agnostic BERT Sentence Embedding.,https://dblp.org/db/conf/acl/acl2022-1.html
acl,2022,Nested Named Entity Recognition with Span-level Graphs.,https://dblp.org/db/conf/acl/acl2022-1.html
acl,2022,CogTaskonomy: Cognitively Inspired Task Taxonomy Is Beneficial to Transfer Learning in NLP.,https://dblp.org/db/conf/acl/acl2022-1.html
acl,2022,RoCBert: Robust Chinese Bert with Multimodal Contrastive Pretraining.,https://dblp.org/db/conf/acl/acl2022-1.html
acl,2022,Premise-based Multimodal Reasoning: Conditional Inference on Joint Textual and Visual Clues.,https://dblp.org/db/conf/acl/acl2022-1.html
acl,2022,Parallel Instance Query Network for Named Entity Recognition.,https://dblp.org/db/conf/acl/acl2022-1.html
acl,2022,ProphetChat: Enhancing Dialogue Generation with Simulation of Future Conversation.,https://dblp.org/db/conf/acl/acl2022-1.html
acl,2022,Modeling Multi-hop Question Answering as Single Sequence Prediction.,https://dblp.org/db/conf/acl/acl2022-1.html
acl,2022,Learning Disentangled Semantic Representations for Zero-Shot Cross-Lingual Transfer in Multilingual Machine Reading Comprehension.,https://dblp.org/db/conf/acl/acl2022-1.html
acl,2022,Multi-Granularity Structural Knowledge Distillation for Language Model Compression.,https://dblp.org/db/conf/acl/acl2022-1.html
acl,2022,Auto-Debias: Debiasing Masked Language Models with Automated Biased Prompts.,https://dblp.org/db/conf/acl/acl2022-1.html
acl,2022,Where to Go for the Holidays: Towards Mixed-Type Dialogs for Clarification of User Goals.,https://dblp.org/db/conf/acl/acl2022-1.html
acl,2022,Semi-supervised Domain Adaptation for Dependency Parsing with Dynamic Matching Network.,https://dblp.org/db/conf/acl/acl2022-1.html
acl,2022,A Closer Look at How Fine-tuning Changes BERT.,https://dblp.org/db/conf/acl/acl2022-1.html
acl,2022,Sentence-aware Contrastive Learning for Open-Domain Passage Retrieval.,https://dblp.org/db/conf/acl/acl2022-1.html
acl,2022,FaiRR: Faithful and Robust Deductive Reasoning over Natural Language.,https://dblp.org/db/conf/acl/acl2022-1.html
acl,2022,HiTab: A Hierarchical Table Dataset for Question Answering and Natural Language Generation.,https://dblp.org/db/conf/acl/acl2022-1.html
acl,2022,Doctor Recommendation in Online Health Forums via Expertise Learning.,https://dblp.org/db/conf/acl/acl2022-1.html
acl,2022,Continual Prompt Tuning for Dialog State Tracking.,https://dblp.org/db/conf/acl/acl2022-1.html
acl,2022,There's a Time and Place for Reasoning Beyond the Image.,https://dblp.org/db/conf/acl/acl2022-1.html
acl,2022,FORTAP: Using Formulas for Numerical-Reasoning-Aware Table Pretraining.,https://dblp.org/db/conf/acl/acl2022-1.html
acl,2022,Multimodal fusion via cortical network inspired losses.,https://dblp.org/db/conf/acl/acl2022-1.html
acl,2022,Modeling Temporal-Modal Entity Graph for Procedural Multimodal Machine Comprehension.,https://dblp.org/db/conf/acl/acl2022-1.html
acl,2022,Explanation Graph Generation via Pre-trained Language Models: An Empirical Study with Contrastive Learning.,https://dblp.org/db/conf/acl/acl2022-1.html
acl,2022,Unsupervised Extractive Opinion Summarization Using Sparse Coding.,https://dblp.org/db/conf/acl/acl2022-1.html
acl,2022,LexSubCon: Integrating Knowledge from Lexical Resources into Contextual Embeddings for Lexical Substitution.,https://dblp.org/db/conf/acl/acl2022-1.html
acl,2022,Think Before You Speak: Explicitly Generating Implicit Commonsense Knowledge for Response Generation.,https://dblp.org/db/conf/acl/acl2022-1.html
acl,2022,Flow-Adapter Architecture for Unsupervised Machine Translation.,https://dblp.org/db/conf/acl/acl2022-1.html
acl,2022,Efficient Unsupervised Sentence Compression by Fine-tuning Transformers with Reinforcement Learning.,https://dblp.org/db/conf/acl/acl2022-1.html
acl,2022,Tracing Origins: Coreference-aware Machine Reading Comprehension.,https://dblp.org/db/conf/acl/acl2022-1.html
acl,2022,WatClaimCheck: A new Dataset for Claim Entailment and Inference.,https://dblp.org/db/conf/acl/acl2022-1.html
acl,2022,"FrugalScore: Learning Cheaper, Lighter and Faster Evaluation Metrics for Automatic Text Generation.",https://dblp.org/db/conf/acl/acl2022-1.html
acl,2022,A Well-Composed Text is Half Done! Composition Sampling for Diverse Conditional Generation.,https://dblp.org/db/conf/acl/acl2022-1.html
acl,2022,Synthetic Question Value Estimation for Domain Adaptation of Question Answering.,https://dblp.org/db/conf/acl/acl2022-1.html
acl,2022,Better Language Model with Hypernym Class Prediction.,https://dblp.org/db/conf/acl/acl2022-1.html
acl,2022,Tackling Fake News Detection by Continually Improving Social Context Representations using Graph Neural Networks.,https://dblp.org/db/conf/acl/acl2022-1.html
acl,2022,Understanding Gender Bias in Knowledge Base Embeddings.,https://dblp.org/db/conf/acl/acl2022-1.html
acl,2022,Computational Historical Linguistics and Language Diversity in South Asia.,https://dblp.org/db/conf/acl/acl2022-1.html
acl,2022,Faithful or Extractive? On Mitigating the Faithfulness-Abstractiveness Trade-off in Abstractive Summarization.,https://dblp.org/db/conf/acl/acl2022-1.html
acl,2022,Slangvolution: A Causal Analysis of Semantic Change and Frequency Dynamics in Slang.,https://dblp.org/db/conf/acl/acl2022-1.html
acl,2022,Spurious Correlations in Reference-Free Evaluation of Text Generation.,https://dblp.org/db/conf/acl/acl2022-1.html
acl,2022,On The Ingredients of an Effective Zero-shot Semantic Parser.,https://dblp.org/db/conf/acl/acl2022-1.html
acl,2022,Bias Mitigation in Machine Translation Quality Estimation.,https://dblp.org/db/conf/acl/acl2022-1.html
acl,2022,Unified Speech-Text Pre-training for Speech Translation and Recognition.,https://dblp.org/db/conf/acl/acl2022-1.html
acl,2022,"Match the Script, Adapt if Multilingual: Analyzing the Effect of Multilingual Pretraining on Cross-lingual Transferability.",https://dblp.org/db/conf/acl/acl2022-1.html
acl,2022,Structured Pruning Learns Compact and Accurate Models.,https://dblp.org/db/conf/acl/acl2022-1.html
acl,2022,How can NLP Help Revitalize Endangered Languages? A Case Study and Roadmap for the Cherokee Language.,https://dblp.org/db/conf/acl/acl2022-1.html
acl,2022,Differentiable Multi-Agent Actor-Critic for Multi-Step Radiology Report Summarization.,https://dblp.org/db/conf/acl/acl2022-1.html
acl,2022,Online Semantic Parsing for Latency Reduction in Task-Oriented Dialogue.,https://dblp.org/db/conf/acl/acl2022-1.html
acl,2022,Few-Shot Tabular Data Enrichment Using Fine-Tuned Transformer Architectures.,https://dblp.org/db/conf/acl/acl2022-1.html
